{
  "key": "seedance-2-5",
  "title": "Seedance 2.5",
  "description": "Video from text, first and last frames, or reference images, clips and sound. Needs a 2.5 resource pack.",
  "kind": "video",
  "provider": "byteplus",
  "providerModel": "dreamina-seedance-2-5-260628",
  "vendor": "bytedance",
  "default": true,
  "modes": ["text", "frames", "reference"],
  "accepts": { "text": { "max": 20 }, "image": { "max": 9 }, "video": { "max": 3 }, "audio": { "max": 3 } },
  "fields": [
    {
      "key": "ratio", "label": "Aspect ratio", "type": "enum", "placement": "inline", "group": "frame", "display": "tiles", "default": "16:9",
      "help": "Not sent with a first frame: the video follows that image",
      "options": [
        { "value": "16:9", "label": "16:9" }, { "value": "9:16", "label": "9:16" }, { "value": "1:1", "label": "1:1" },
        { "value": "4:3", "label": "4:3" }, { "value": "3:4", "label": "3:4" }, { "value": "21:9", "label": "21:9" },
        { "value": "adaptive", "label": "Adaptive" }
      ]
    },
    {
      "key": "resolution", "label": "Resolution", "type": "enum", "placement": "inline", "group": "frame", "display": "segment", "default": "720p",
      "options": [{ "value": "480p", "label": "480p" }, { "value": "720p", "label": "720p" }, { "value": "1080p", "label": "1080p" }]
    },
    { "key": "duration", "label": "Duration", "type": "duration", "placement": "inline", "min": 4, "max": 30, "step": 1, "unit": "s", "default": 5 }
  ],
  "cancel": "queued",
  "limits": { "durationSec": { "min": 4, "max": 30 }, "promptChars": 4000 },
  "eta": { "baseSec": 45, "perSecondSec": 12, "deadlineSec": 3600 },
  "slots": 10
}
